{
  "id": "book_sample_001",
  "scope": "book",
  "name": "示例单书口吻",
  "genre": "都市/系统流",
  "narration_rules": [
    "旁白必须短，优先让现实反馈说话",
    "情绪高点先落在动作和场景结果，不先下结论"
  ],
  "forbidden_phrases": [
    "空气里弥漫着",
    "仿佛命运"
  ],
  "caution_phrases": [
    "此刻",
    "只见"
  ],
  "forbidden_words": [
    "宿命",
    "窒息"
  ],
  "caution_words": [
    "沉重"
  ],
  "allowed_phrases": [],
  "allowed_authorial_patterns": [],
  "preferred_patterns": [
    "即时反馈",
    "现实反应",
    "动作结果"
  ],
  "thresholds": {
    "authorial_narration_tolerance": 0,
    "soft_authorial_tolerance": 1,
    "abstract_word_tolerance": 2,
    "repeated_phrase_tolerance": 1,
    "lyrical_paragraph_tolerance": 1
  },
  "notes": [
    "这是示例条目。真实项目应在 00_memory/style.md 或本目录下维护专属 profile。"
  ]
}
